{
  "schema_version": "1.0",
  "pack": "recognition-happens-before-understanding",
  "source": "queue/recognition_happens_before_understanding_platinum.py",
  "thesis": "A meaningful whole can be recognized before discursive analysis, but mature understanding tests that recognition and returns corrected parts to a transformed whole.",
  "continuity_material": {
    "name": "living spectral invariant",
    "initial": "A blurred phase-coherent form is felt before its structure is available.",
    "stress": "Analytical prisms, projection, and false matches divide or force the form.",
    "integrated": "The form returns with visible seams, evidence channels, and a wider boundary."
  },
  "color_roles": {
    "cyan": "incoming evidence and pre-discursive coherence",
    "gold": "recognized whole and integrated meaning",
    "coral": "projection, mismatch, and corrective friction",
    "violet": "discursive description and classification",
    "white": "reflexive awareness and verified relation"
  },
  "arc": {
    "latent": "The audience senses an invariant before it is clear.",
    "formation": "Whole-form completion, melody, atmosphere, and expertise show recognition arriving first.",
    "stress": "Language, analysis, false familiarity, and projection fracture or counterfeit the whole.",
    "revision": "Bottom-up evidence and top-down expectation meet without extinguishing intuition.",
    "integration": "Parts and corrections return to a living whole that can examine itself."
  },
  "scenes": [
    {
      "shader": "vis_blur_known.glsl",
      "source_visual": "v_blur_known",
      "phase": "latent",
      "role": "establish",
      "claim": "Meaning can precede optical clarity.",
      "verb": "emerge",
      "topology": "fog field to coherent invariant",
      "composition": "off-axis macro apparition",
      "material_state": "blurred spectral whole",
      "camera": "slow approach through haze",
      "u_semantics": "The invariant sharpens without being newly assembled.",
      "t_semantics": "Haze and internal phase breathe continuously.",
      "audio_volume_semantics": "Volume increases coherence depth inside the form.",
      "audio_beat_semantics": "Beats briefly expose the invariant rim.",
      "glance_thesis": "A whole is present before its details are clear.",
      "rationale": "The viewer should recognize presence before receiving parts.",
      "risk": "Blur could erase the thesis.",
      "review_target": "Readable silhouette at low and mature revelation."
    },
    {
      "shader": "vis_face_flash.glsl",
      "source_visual": "v_face_flash",
      "phase": "formation",
      "role": "disclose",
      "claim": "A face-like relation arrives as a rapid whole.",
      "verb": "recognize",
      "topology": "paired cues inside one flash boundary",
      "composition": "symmetry flash close-up",
      "material_state": "relational aperture",
      "camera": "instant optical punch-in",
      "u_semantics": "A surrounding recognition ring arrives after sparse cues.",
      "t_semantics": "The cues hold while fine light trembles.",
      "audio_volume_semantics": "Volume thickens relational glow, not the cues.",
      "audio_beat_semantics": "A beat triggers the recognition flash.",
      "glance_thesis": "Sparse features become one relation at once.",
      "rationale": "Abstract symmetry avoids a literal cartoon face.",
      "risk": "May read as an icon rather than perception.",
      "review_target": "Flash must unify cues without turning into a logo."
    },
    {
      "shader": "vis_global_precedence.glsl",
      "source_visual": "v_global_precedence",
      "phase": "formation",
      "role": "model",
      "claim": "Parts gain identity from an already organizing whole.",
      "verb": "gather",
      "topology": "distributed agents to whole-form boundary",
      "composition": "wide particle convergence",
      "material_state": "phase-locking particles",
      "camera": "fixed field while matter self-organizes",
      "u_semantics": "Particles align to a whole before the contour appears.",
      "t_semantics": "Local agents jitter while the relation persists.",
      "audio_volume_semantics": "Volume increases convergence reach.",
      "audio_beat_semantics": "Beats synchronize local phase.",
      "glance_thesis": "The whole organizes the parts that seem to build it.",
      "rationale": "Bidirectional dependence is clearer as phase agreement.",
      "risk": "Could repeat the previous perceptual-crystal pack.",
      "review_target": "Prioritize whole-before-analysis over mere object formation."
    },
    {
      "shader": "vis_part_analysis.glsl",
      "source_visual": "v_part_analysis",
      "phase": "stress",
      "role": "model",
      "claim": "Explanation makes the whole communicable by separating relations.",
      "verb": "split",
      "topology": "living whole to orbiting analytical panels",
      "composition": "radial exploded diagram",
      "material_state": "measured spectral shards",
      "camera": "pull back as components separate",
      "u_semantics": "The whole disperses into inspectable panels.",
      "t_semantics": "Measurements oscillate while remaining linked.",
      "audio_volume_semantics": "Volume energizes channels between parts.",
      "audio_beat_semantics": "Beats punctuate panel separation.",
      "glance_thesis": "Analysis gains access by breaking a whole into relations.",
      "rationale": "The visual grants analysis real value before showing its risk.",
      "risk": "Panels can become a static infographic.",
      "review_target": "Separation must remain visibly connected to the source whole."
    },
    {
      "shader": "vis_pratibha.glsl",
      "source_visual": "v_pratibha",
      "phase": "formation",
      "role": "disclose",
      "claim": "Meaning can appear as an intelligent flash.",
      "verb": "emerge",
      "topology": "point event to expanding intelligibility field",
      "composition": "concentric revelation burst",
      "material_state": "gold coherence wave",
      "camera": "wide aperture opens from the center",
      "u_semantics": "A flash expands and discloses the whole in one act.",
      "t_semantics": "The disclosed form keeps subtle internal motion.",
      "audio_volume_semantics": "Volume increases the wave's spatial reach.",
      "audio_beat_semantics": "Beats sharpen the initial disclosure.",
      "glance_thesis": "An undivided flash precedes a chain of reasons.",
      "rationale": "Expansion makes pre-discursive intelligence spatially immediate.",
      "risk": "Pure spectacle could lack conceptual specificity.",
      "review_target": "The form must appear with the wave, not after it."
    },
    {
      "shader": "vis_pratyabhijna.glsl",
      "source_visual": "v_pratyabhijna",
      "phase": "formation",
      "role": "deepen",
      "claim": "Recognition relates present appearance to latent intelligibility.",
      "verb": "bind",
      "topology": "this appearance linked to prior invariant",
      "composition": "lateral paired identity",
      "material_state": "two temporal states of one form",
      "camera": "sideways parallax between appearances",
      "u_semantics": "A channel locks two different appearances into one identity.",
      "t_semantics": "Each appearance evolves independently around the relation.",
      "audio_volume_semantics": "Volume strengthens the identity channel.",
      "audio_beat_semantics": "Beats briefly phase-lock both states.",
      "glance_thesis": "Identity is recovered through relation, not derived from parts.",
      "rationale": "Two states and one channel distinguish recognition from recall.",
      "risk": "Could read as simple matching.",
      "review_target": "The two forms must remain visibly non-identical."
    },
    {
      "shader": "vis_melody.glsl",
      "source_visual": "v_melody",
      "phase": "formation",
      "role": "deepen",
      "claim": "A temporal phrase is heard as one gesture before measurement.",
      "verb": "bind",
      "topology": "successive nodes inside one continuous ribbon",
      "composition": "panoramic temporal wave",
      "material_state": "cyan-gold sound ribbon",
      "camera": "tracks laterally with the phrase",
      "u_semantics": "Discrete notes reveal the continuous phrase that binds them.",
      "t_semantics": "Energy travels along the living curve.",
      "audio_volume_semantics": "Volume thickens the temporal gesture.",
      "audio_beat_semantics": "Beats pulse along node-to-node channels.",
      "glance_thesis": "The phrase exceeds the sum of its measured notes.",
      "rationale": "Continuous motion makes whole-across-time directly visible.",
      "risk": "May resemble a generic waveform.",
      "review_target": "Nodes and ribbon must remain conceptually distinct."
    },
    {
      "shader": "vis_rasa.glsl",
      "source_visual": "v_rasa",
      "phase": "formation",
      "role": "deepen",
      "claim": "Atmosphere is recognized before its causes are reconstructed.",
      "verb": "gather",
      "topology": "multiple sources to shared affective field",
      "composition": "immersive radial atmosphere",
      "material_state": "overlapping spectral beams",
      "camera": "inside the field rather than outside it",
      "u_semantics": "Separate influences become one affective weather.",
      "t_semantics": "Beams and caustic contours drift at different rates.",
      "audio_volume_semantics": "Volume deepens overlap between influences.",
      "audio_beat_semantics": "Beats momentarily align the atmosphere.",
      "glance_thesis": "Many causes are first felt as one mood.",
      "rationale": "The audience should inhabit the combined field.",
      "risk": "Atmosphere can become beautiful but vague.",
      "review_target": "Keep source beams faintly recoverable inside the whole."
    },
    {
      "shader": "vis_expertise.glsl",
      "source_visual": "v_expertise",